{
  "shot_no": 1,
  "request_id": "waveform-ingest:1",
  "measurement": "waveform",
  "source_system": "TDMS_DERIVED",
  "authority_level": "PROVISIONAL",
  "signals": [
    {
      "shot_no": 1,
      "artifact_id": "tdms:1:tube:ac8f9243322d",
      "source_role": "PRIMARY",
      "data_type": "TUBE",
      "channel_name": "InPower",
      "process_id": "ECRH:RF:IN_POWER",
      "file_path": "data/TUBE/1/1_Tube.tdms",
      "sample_count": 10400,
      "declared_sample_count": 1,
      "sample_interval_seconds": 0.001,
      "start_time": "2023-03-29T04:43:39.995073Z",
      "end_time": "2023-03-29T04:43:50.394073Z",
      "shot_range": [
        0,
        10399
      ]
    },
    {
      "shot_no": 1,
      "artifact_id": "tdms:1:tube:ac8f9243322d",
      "source_role": "PRIMARY",
      "data_type": "TUBE",
      "channel_name": "RefPower",
      "process_id": "ECRH:RF:REF_POWER",
      "file_path": "data/TUBE/1/1_Tube.tdms",
      "sample_count": 10400,
      "declared_sample_count": 1,
      "sample_interval_seconds": 0.001,
      "start_time": "2023-03-29T04:43:39.995084Z",
      "end_time": "2023-03-29T04:43:50.394084Z",
      "shot_range": [
        0,
        10399
      ]
    },
    {
      "shot_no": 1,
      "artifact_id": "tdms:1:tube:ac8f9243322d",
      "source_role": "PRIMARY",
      "data_type": "TUBE",
      "channel_name": "NegVoltage",
      "process_id": "ECRH:HVPS:NEG_VOLT",
      "file_path": "data/TUBE/1/1_Tube.tdms",
      "sample_count": 10400,
      "declared_sample_count": 1,
      "sample_interval_seconds": 0.001,
      "start_time": "2023-03-29T04:43:39.995095Z",
      "end_time": "2023-03-29T04:43:50.394095Z",
      "shot_range": [
        0,
        10399
      ]
    },
    {
      "shot_no": 1,
      "artifact_id": "tdms:1:tube:ac8f9243322d",
      "source_role": "PRIMARY",
      "data_type": "TUBE",
      "channel_name": "NegCurrent",
      "process_id": "ECRH:HVPS:NEG_CURRENT",
      "file_path": "data/TUBE/1/1_Tube.tdms",
      "sample_count": 10400,
      "declared_sample_count": 1,
      "sample_interval_seconds": 0.001,
      "start_time": "2023-03-29T04:43:39.995106Z",
      "end_time": "2023-03-29T04:43:50.394106Z",
      "shot_range": [
        0,
        10399
      ]
    },
    {
      "shot_no": 1,
      "artifact_id": "tdms:1:tube:ac8f9243322d",
      "source_role": "PRIMARY",
      "data_type": "TUBE",
      "channel_name": "PosVoltage",
      "process_id": "ECRH:HVPS:POS_VOLT",
      "file_path": "data/TUBE/1/1_Tube.tdms",
      "sample_count": 10400,
      "declared_sample_count": 1,
      "sample_interval_seconds": 0.001,
      "start_time": "2023-03-29T04:43:39.995117Z",
      "end_time": "2023-03-29T04:43:50.394117Z",
      "shot_range": [
        0,
        10399
      ]
    },
    {
      "shot_no": 1,
      "artifact_id": "tdms:1:tube:ac8f9243322d",
      "source_role": "PRIMARY",
      "data_type": "TUBE",
      "channel_name": "PosCurrent",
      "process_id": "ECRH:HVPS:POS_CURRENT",
      "file_path": "data/TUBE/1/1_Tube.tdms",
      "sample_count": 10400,
      "declared_sample_count": 1,
      "sample_interval_seconds": 0.001,
      "start_time": "2023-03-29T04:43:39.995128Z",
      "end_time": "2023-03-29T04:43:50.394128Z",
      "shot_range": [
        0,
        10399
      ]
    },
    {
      "shot_no": 1,
      "artifact_id": "tdms:1:tube:ac8f9243322d",
      "source_role": "PRIMARY",
      "data_type": "TUBE",
      "channel_name": "FilaVoltage",
      "process_id": "ECRH:GYROTRON:FILA_VOLT",
      "file_path": "data/TUBE/1/1_Tube.tdms",
      "sample_count": 10400,
      "declared_sample_count": 1,
      "sample_interval_seconds": 0.001,
      "start_time": "2023-03-29T04:43:39.995139Z",
      "end_time": "2023-03-29T04:43:50.394139Z",
      "shot_range": [
        0,
        10399
      ]
    },
    {
      "shot_no": 1,
      "artifact_id": "tdms:1:tube:ac8f9243322d",
      "source_role": "PRIMARY",
      "data_type": "TUBE",
      "channel_name": "FilaCurrent",
      "process_id": "ECRH:GYROTRON:FILA_CURRENT",
      "file_path": "data/TUBE/1/1_Tube.tdms",
      "sample_count": 10400,
      "declared_sample_count": 1,
      "sample_interval_seconds": 0.001,
      "start_time": "2023-03-29T04:43:39.995150Z",
      "end_time": "2023-03-29T04:43:50.394150Z",
      "shot_range": [
        0,
        10399
      ]
    },
    {
      "shot_no": 1,
      "artifact_id": "tdms:1:tube:ac8f9243322d",
      "source_role": "PRIMARY",
      "data_type": "TUBE",
      "channel_name": "TiPumpCurrent",
      "process_id": "ECRH:VACUUM:TI_PUMP_CURRENT",
      "file_path": "data/TUBE/1/1_Tube.tdms",
      "sample_count": 10400,
      "declared_sample_count": 1,
      "sample_interval_seconds": 0.001,
      "start_time": "2023-03-29T04:43:39.995161Z",
      "end_time": "2023-03-29T04:43:50.394161Z",
      "shot_range": [
        0,
        10399
      ]
    },
    {
      "shot_no": 1,
      "artifact_id": "tdms:1:water:9d5f564bcd7c",
      "source_role": "AUXILIARY",
      "data_type": "WATER",
      "channel_name": "140阳极T1进",
      "process_id": "ECRH:COOLING:TEMP_140_ANODE_T1_INLET",
      "file_path": "data/TUBE/1/1_Water.tdms",
      "sample_count": 10225,
      "declared_sample_count": 1,
      "sample_interval_seconds": 0.001,
      "start_time": "2023-03-29T04:43:39.995061Z",
      "end_time": "2023-03-29T04:43:50.219061Z",
      "shot_range": [
        0,
        10224
      ]
    },
    {
      "shot_no": 1,
      "artifact_id": "tdms:1:water:9d5f564bcd7c",
      "source_role": "AUXILIARY",
      "data_type": "WATER",
      "channel_name": "140阳极T1回",
      "process_id": "ECRH:COOLING:TEMP_140_ANODE_T1_RETURN",
      "file_path": "data/TUBE/1/1_Water.tdms",
      "sample_count": 10225,
      "declared_sample_count": 1,
      "sample_interval_seconds": 0.001,
      "start_time": "2023-03-29T04:43:39.995072Z",
      "end_time": "2023-03-29T04:43:50.219072Z",
      "shot_range": [
        0,
        10224
      ]
    },
    {
      "shot_no": 1,
      "artifact_id": "tdms:1:water:9d5f564bcd7c",
      "source_role": "AUXILIARY",
      "data_type": "WATER",
      "channel_name": "140主窗口T2回",
      "process_id": "ECRH:COOLING:TEMP_140_MAIN_WINDOW_T2_RETURN",
      "file_path": "data/TUBE/1/1_Water.tdms",
      "sample_count": 10225,
      "declared_sample_count": 1,
      "sample_interval_seconds": 0.001,
      "start_time": "2023-03-29T04:43:39.995083Z",
      "end_time": "2023-03-29T04:43:50.219083Z",
      "shot_range": [
        0,
        10224
      ]
    },
    {
      "shot_no": 1,
      "artifact_id": "tdms:1:water:9d5f564bcd7c",
      "source_role": "AUXILIARY",
      "data_type": "WATER",
      "channel_name": "140收集极T5进",
      "process_id": "ECRH:COOLING:TEMP_140_COLLECTOR_T5_INLET",
      "file_path": "data/TUBE/1/1_Water.tdms",
      "sample_count": 10225,
      "declared_sample_count": 1,
      "sample_interval_seconds": 0.001,
      "start_time": "2023-03-29T04:43:39.995094Z",
      "end_time": "2023-03-29T04:43:50.219094Z",
      "shot_range": [
        0,
        10224
      ]
    },
    {
      "shot_no": 1,
      "artifact_id": "tdms:1:water:9d5f564bcd7c",
      "source_role": "AUXILIARY",
      "data_type": "WATER",
      "channel_name": "140收集极回",
      "process_id": "ECRH:COOLING:TEMP_140_COLLECTOR_RETURN",
      "file_path": "data/TUBE/1/1_Water.tdms",
      "sample_count": 10225,
      "declared_sample_count": 1,
      "sample_interval_seconds": 0.001,
      "start_time": "2023-03-29T04:43:39.995105Z",
      "end_time": "2023-03-29T04:43:50.219105Z",
      "shot_range": [
        0,
        10224
      ]
    },
    {
      "shot_no": 1,
      "artifact_id": "tdms:1:water:9d5f564bcd7c",
      "source_role": "AUXILIARY",
      "data_type": "WATER",
      "channel_name": "140镜子T6回",
      "process_id": "ECRH:COOLING:TEMP_140_MIRROR_T6_RETURN",
      "file_path": "data/TUBE/1/1_Water.tdms",
      "sample_count": 10225,
      "declared_sample_count": 1,
      "sample_interval_seconds": 0.001,
      "start_time": "2023-03-29T04:43:39.995116Z",
      "end_time": "2023-03-29T04:43:50.219116Z",
      "shot_range": [
        0,
        10224
      ]
    },
    {
      "shot_no": 1,
      "artifact_id": "tdms:1:water:9d5f564bcd7c",
      "source_role": "AUXILIARY",
      "data_type": "WATER",
      "channel_name": "140管体T7回",
      "process_id": "ECRH:COOLING:TEMP_140_TUBE_BODY_T7_RETURN",
      "file_path": "data/TUBE/1/1_Water.tdms",
      "sample_count": 10225,
      "declared_sample_count": 1,
      "sample_interval_seconds": 0.001,
      "start_time": "2023-03-29T04:43:39.995127Z",
      "end_time": "2023-03-29T04:43:50.219127Z",
      "shot_range": [
        0,
        10224
      ]
    },
    {
      "shot_no": 1,
      "artifact_id": "tdms:1:water:9d5f564bcd7c",
      "source_role": "AUXILIARY",
      "data_type": "WATER",
      "channel_name": "140MOU T8回",
      "process_id": "ECRH:COOLING:TEMP_140_MOU_T8_RETURN",
      "file_path": "data/TUBE/1/1_Water.tdms",
      "sample_count": 10225,
      "declared_sample_count": 1,
      "sample_interval_seconds": 0.001,
      "start_time": "2023-03-29T04:43:39.995138Z",
      "end_time": "2023-03-29T04:43:50.219138Z",
      "shot_range": [
        0,
        10224
      ]
    },
    {
      "shot_no": 1,
      "artifact_id": "tdms:1:water:9d5f564bcd7c",
      "source_role": "AUXILIARY",
      "data_type": "WATER",
      "channel_name": "140小负载T9回",
      "process_id": "ECRH:COOLING:TEMP_140_SMALL_LOAD_T9_RETURN",
      "file_path": "data/TUBE/1/1_Water.tdms",
      "sample_count": 10225,
      "declared_sample_count": 1,
      "sample_interval_seconds": 0.001,
      "start_time": "2023-03-29T04:43:39.995149Z",
      "end_time": "2023-03-29T04:43:50.219149Z",
      "shot_range": [
        0,
        10224
      ]
    },
    {
      "shot_no": 1,
      "artifact_id": "tdms:1:water:9d5f564bcd7c",
      "source_role": "AUXILIARY",
      "data_type": "WATER",